{"denominator":10000000000000000000000000000,"printed_decimal":"0.9974252022196793","reach":96000,"source":"CHRONOS accepted Arena solution 2386, converted from /private/tmp/pnt_candidate_96000_safe_scaled.json decimal literals","support":[{"k":2,"value":-10000989053719092000000000000},{"k":3,"value":-10000989053742488000000000000},{"k":5,"value":-10000989053761569000000000000},{"k":6,"value":10000989053703253000000000000},{"k":7,"value":-10000989053752112000000000000},{"k":10,"value":10000989053590660000000000000},{"k":11,"value":-10000989053786555000000000000},{"k":13,"value":-10000989053808838000000000000},{"k":14,"value":10000989053570315000000000000},{"k":15,"value":10000989053700582000000000000},{"k":17,"value":-10000989053844700000000000000},{"k":19,"value":-10000989053795640000000000000},{"k":21,"value":10000989053386924000000000000},{"k":22,"value":10000989053468206000000000000},{"k":23,"value":-10000989053708769000000000000},{"k":26,"value":10000989052924816000000000000},{"k":29,"value":-10000989053423690000000000000},{"k":30,"value":-10000989054490481000000000000},{"k":31,"value":-10000989052906508000000000000},{"k":33,"value":10000989052767093000000000000},{"k":34,"value":10000989053751064000000000000},{"k":35,"value":10000989053362417000000000000},{"k":37,"value":-10000989053992766000000000000},{"k":38,"value":10000989053250810000000000000},{"k":39,"value":10000989053426486000000000000},{"k":41,"value":-10000989053561440000000000000},{"k":42,"value":-10000989054821743000000000000},{"k":43,"value":-10000989052663667000000000000},{"k":46,"value":10000989051604023000000000000},{"k":47,"value":-10000989053139953000000000000},{"k":51,"value":10000989052084244000000000000},{"k":53,"value":-10000989050663662000000000000},{"k":55,"value":10000989051993483000000000000},{"k":57,"value":10000989049387246000000000000},{"k":58,"value":10000989052876184000000000000},{"k":59,"value":-10000989050466464000000000000},{"k":61,"value":-10000989051830116000000000000},{"k":62,"value":10000989049524510000000000000},{"k":65,"value":10000989050687537000000000000},{"k":66,"value":-10000989053640843000000000000},{"k":67,"value":-10000989048807838000000000000},{"k":69,"value":10000989046595774000000000000},{"k":70,"value":-10000989054437306000000000000},{"k":71,"value":-10000989047729467000000000000},{"k":73,"value":-10000989052105844000000000000},{"k":74,"value":10000989051003648000000000000},{"k":77,"value":10000989051842970000000000000},{"k":78,"value":-10000989063343250000000000000},{"k":79,"value":-10000989043934085000000000000},{"k":82,"value":10000989045764188000000000000},{"k":83,"value":-10000989043881627000000000000},{"k":85,"value":10000989048928228000000000000},{"k":86,"value":10000989053904080000000000000},{"k":87,"value":10000989047592062000000000000},{"k":89,"value":-10000989044103300000000000000},{"k":91,"value":10000989050439406000000000000},{"k":93,"value":10000989046904403000000000000},{"k":94,"value":10000989048512512000000000000},{"k":95,"value":10000989054463358000000000000},{"k":97,"value":-10000989057752020000000000000},{"k":101,"value":-10000989045362692000000000000},{"k":102,"value":-10000989058721264000000000000},{"k":103,"value":-10000989042114463000000000000},{"k":105,"value":-10000989069787065000000000000},{"k":106,"value":10000989030814253000000000000},{"k":107,"value":-10000989023883349000000000000},{"k":109,"value":-10000989049997022000000000000},{"k":110,"value":-10000989054797520000000000000},{"k":111,"value":10000989048923377000000000000},{"k":113,"value":-10000989046726440000000000000},{"k":114,"value":-10000989057028062000000000000},{"k":115,"value":10000989048304503000000000000},{"k":118,"value":10000989042699338000000000000},{"k":119,"value":10000989057465100000000000000},{"k":122,"value":10000989053266347000000000000},{"k":123,"value":10000989042945436000000000000},{"k":127,"value":-10000989030064930000000000000},{"k":129,"value":10000989031461263000000000000},{"k":130,"value":-10000989045522766000000000000},{"k":131,"value":-10000989044367177000000000000},{"k":133,"value":10000989038122990000000000000},{"k":134,"value":10000989031242775000000000000},{"k":137,"value":-10000989022568950000000000000},{"k":138,"value":-10000989073296724000000000000},{"k":139,"value":-10000989022906643000000000000},{"k":141,"value":10000989040757164000000000000},{"k":142,"value":10000989050179403000000000000},{"k":143,"value":10000989050445617000000000000},{"k":145,"value":10000989033892007000000000000},{"k":146,"value":10000989027994458000000000000},{"k":149,"value":-10000989013303843000000000000},{"k":151,"value":-10000989052828170000000000000},{"k":154,"value":-10000989055218363000000000000},{"k":155,"value":10000989023635543000000000000},{"k":157,"value":-10000988987387014000000000000},{"k":158,"value":10000989005091643000000000000},{"k":159,"value":10000989051562856000000000000},{"k":161,"value":10000989008529297000000000000},{"k":163,"value":-10000988986717838000000000000},{"k":165,"value":-10000989068987822000000000000},{"k":166,"value":10000988910710453000000000000},{"k":167,"value":-10000988921935480000000000000},{"k":170,"value":-10000989047284998000000000000},{"k":173,"value":-10000989043834825000000000000},{"k":174,"value":-10000989062453030000000000000},{"k":177,"value":10000989014744357000000000000},{"k":178,"value":10000988958556880000000000000},{"k":179,"value":-10000988923089145000000000000},{"k":181,"value":-10000989069561568000000000000},{"k":182,"value":-10000989020133144000000000000},{"k":183,"value":10000989022055917000000000000},{"k":185,"value":10000989026871634000000000000},{"k":186,"value":-10000989000812601000000000000},{"k":187,"value":10000989022302265000000000000},{"k":190,"value":-10000989128001863000000000000},{"k":191,"value":-10000988971959814000000000000},{"k":193,"value":-10000988998463456000000000000},{"k":194,"value":10000988936604676000000000000},{"k":195,"value":-10000988981614960000000000000},{"k":197,"value":-10000989044192490000000000000},{"k":199,"value":-10000989021583300000000000000},{"k":201,"value":10000989022135773000000000000},{"k":202,"value":10000989051496334000000000000},{"k":203,"value":10000988998839610000000000000},{"k":205,"value":10000989090255280000000000000},{"k":206,"value":10000989031714410000000000000},{"k":209,"value":10000989021382523000000000000},{"k":210,"value":10000989027989509000000000000},{"k":211,"value":-10000988915621414000000000000},{"k":213,"value":10000988948175802000000000000},{"k":214,"value":10000989045432938000000000000},{"k":215,"value":10000989099526525000000000000},{"k":217,"value":10000988893455751000000000000},{"k":218,"value":10000989164828470000000000000},{"k":219,"value":10000989002467002000000000000},{"k":221,"value":10000988908743530000000000000},{"k":222,"value":-10000988987229746000000000000},{"k":223,"value":-10000988912959874000000000000},{"k":226,"value":10000988777393263000000000000},{"k":227,"value":-10000988756821460000000000000},{"k":229,"value":-10000989008839831000000000000},{"k":230,"value":-10000989145144041000000000000},{"k":231,"value":-10000989094682367000000000000},{"k":233,"value":-10000988942360520000000000000},{"k":235,"value":10000989053700520000000000000},{"k":237,"value":10000988857831685000000000000},{"k":238,"value":-10000989314565187000000000000},{"k":239,"value":-10000988644133780000000000000},{"k":241,"value":-10000989026801554000000000000},{"k":246,"value":-10000989059456302000000000000},{"k":247,"value":10000989061488370000000000000},{"k":249,"value":10000988929623664000000000000},{"k":251,"value":-10000988920230480000000000000},{"k":253,"value":10000989013423467000000000000},{"k":254,"value":10000988949252583000000000000},{"k":255,"value":-10000989002328373000000000000},{"k":257,"value":-10000989029371950000000000000},{"k":258,"value":-10000988994777107000000000000},{"k":259,"value":10000988973095460000000000000},{"k":262,"value":10000988834505090000000000000},{"k":263,"value":-10000988732570428000000000000},{"k":265,"value":10000988835803897000000000000},{"k":266,"value":-10000988965734072000000000000},{"k":267,"value":10000988929447752000000000000},{"k":269,"value":-10000988901009422000000000000},{"k":271,"value":-10000988936326065000000000000},{"k":273,"value":-10000989084716450000000000000},{"k":274,"value":10000988900761223000000000000},{"k":277,"value":-10000988855288775000000000000},{"k":278,"value":10000988867187914000000000000},{"k":281,"value":-10000988993130573000000000000},{"k":282,"value":-10000989008833916000000000000},{"k":283,"value":-10000989026898104000000000000},{"k":285,"value":-10000989052531117000000000000},{"k":286,"value":-10000989072585096000000000000},{"k":287,"value":10000988945618974000000000000},{"k":290,"value":-10000988877414032000000000000},{"k":291,"value":10000988867022227000000000000},{"k":293,"value":-10000988843927110000000000000},{"k":295,"value":10000988953891754000000000000},{"k":298,"value":10000988793560040000000000000},{"k":299,"value":10000989284115045000000000000},{"k":301,"value":10000989077534554000000000000},{"k":302,"value":10000988726816489000000000000},{"k":303,"value":10000989278652985000000000000},{"k":305,"value":10000987800822860000000000000},{"k":307,"value":-10000987726734332000000000000},{"k":309,"value":10000986618850092000000000000},{"k":310,"value":-10000988344577113000000000000},{"k":311,"value":-10000987372706511000000000000},{"k":313,"value":-10000988868140601000000000000},{"k":314,"value":10000988692008537000000000000},{"k":317,"value":-10000988756129680000000000000},{"k":318,"value":-10000988943269726000000000000},{"k":319,"value":10000988840621360000000000000},{"k":321,"value":10000988861263784000000000000},{"k":322,"value":-10000988697606290000000000000},{"k":323,"value":10000988866418972000000000000},{"k":326,"value":10000988799872108000000000000},{"k":327,"value":10000989250268295000000000000},{"k":329,"value":10000988788827034000000000000},{"k":330,"value":10000984106058070000000000000},{"k":331,"value":-1000098366